{
  "schema_version": "event-baseline/v1",
  "hazard": "cold-snap",
  "event": {
    "event_id": "mn-2018-01-01-arctic",
    "parent_system_id": "upper_midwest_2018-01-01_arctic",
    "primary_hazard": "extreme_cold",
    "secondary_hazards": [],
    "compound": false,
    "source_event_ids": ["726380"],
    "context_window": {
      "start_utc": "2017-12-29T00:00:00Z",
      "end_utc": "2018-01-09T00:00:00Z"
    },
    "event_window": {
      "start_utc": "2017-12-31T00:00:00Z",
      "end_utc": "2018-01-07T00:00:00Z"
    },
    "recovery_window": {
      "start_utc": "2018-01-07T00:00:00Z",
      "end_utc": "2018-01-09T00:00:00Z"
    },
    "disposition": "candidate_only",
    "selection_basis": "NCEI Storm Events episode 121337, event 726380, is an independent cold candidate pending matched weather/outage evidence.",
    "exclusions": [],
    "uncertainties": [
      "EAGLE-I and canonical county/zone weather coverage have not been collected for this candidate; it cannot be accepted."
    ]
  },
  "source_receipts": [
    {
      "receipt_id": "ncei_stormevents_2018",
      "provider": "NOAA NCEI",
      "url": "https://www.ncei.noaa.gov/pub/data/swdi/stormevents/csvfiles/StormEvents_details-ftp_v1.0_d2018_c20260323.csv.gz",
      "release": "c20260323",
      "retrieved_at_utc": "2026-09-06T07:10:48Z",
      "license_or_access": "Public NOAA access; license not independently verified in this collection pass.",
      "raw_sha256": null,
      "filtered_sha256": null,
      "bytes": null,
      "etag": null,
      "units": "Storm Events local begin/end times and event classifications.",
      "timezone_conversion": "Local-to-UTC receipt verification is still required for final acceptance.",
      "filters": "MINNESOTA; EPISODE_ID=121337; EVENT_ID=726380; EVENT_TYPE=Extreme Cold/Wind Chill.",
      "grid_index_mapping": "County FIPS resolved against Census TIGER/Line 2024 county vintage; no gridded index used.",
      "gaps": [
        "Raw binary hash and bytes not retained."
      ]
    }
  ],
  "records": [
    {
      "record_id": "mn-2018-01-01-arctic-27013-20180101t120000z",
      "county_fips": "27013",
      "boundary_vintage": "Census TIGER/Line 2024",
      "scenario_id": "mn-2018-01-01-arctic-replay",
      "window_start_utc": "2018-01-01T12:00:00Z",
      "window_end_utc": "2018-01-01T18:00:00Z",
      "disposition": "candidate_only",
      "mode": "replay",
      "provenance_receipt_ids": [
        "ncei_stormevents_2018"
      ],
      "source_evidence_status": "unavailable",
      "source_row_keys": [],
      "source_slices": [],
      "weather": {
        "coverage": "uncovered",
        "evidence_kind": "not_assessed",
        "observation_kind": "not_applicable",
        "source_receipt_ids": [],
        "expected_samples": null,
        "observed_samples": null,
        "missing_timestamps": [],
        "event_report": null,
        "notes": "Candidate discovery only; county/zone weather evidence has not been matched to this canonical window."
      },
      "outage": {
        "coverage": "uncovered",
        "evidence_kind": "not_assessed",
        "observation_kind": "not_applicable",
        "source_receipt_ids": [],
        "expected_samples": null,
        "observed_samples": null,
        "missing_timestamps": [],
        "event_report": null,
        "notes": "EAGLE-I coverage not collected; no zero-outage inference."
      },
      "matched_coverage_decision": "unavailable",
      "label": {
        "rule_version": "county_outage_5pct_v1",
        "status": "unavailable",
        "observed_outage_customers": null,
        "customer_denominator": {
          "status": "unavailable",
          "value": null
        },
        "outage_rate": null,
        "positive": null
      },
      "forecast": {
        "prediction_cutoff_utc": null,
        "forecast_evaluation": "not_forecast_scored",
        "inputs": []
      }
    }
  ]
}
