{
  "schema_version": "event-baseline/v1",
  "hazard": "ice-freezing-rain",
  "event": {
    "event_id": "mn-2019-04-10-ice",
    "parent_system_id": "upper_midwest_2019-04-10_cyclone",
    "primary_hazard": "ice_storm",
    "secondary_hazards": [
      "blizzard",
      "heavy_snow",
      "strong_wind"
    ],
    "compound": true,
    "source_event_ids": [
      "ncei:2019:139802:840941"
    ],
    "context_window": {
      "start_utc": "2019-04-08T00:00:00Z",
      "end_utc": "2019-04-15T00:00:00Z"
    },
    "event_window": {
      "start_utc": "2019-04-10T21:00:00Z",
      "end_utc": "2019-04-11T21:00:00Z"
    },
    "recovery_window": {
      "start_utc": "2019-04-11T21:00:00Z",
      "end_utc": "2019-04-15T00:00:00Z"
    },
    "disposition": "candidate_only",
    "selection_basis": "NCEI episode 139802/event 840941 reports an Ice Storm in the Jackson forecast zone; the NWS Sioux Falls archive documents regional freezing rain, icing, and power outages.",
    "exclusions": [],
    "uncertainties": [
      "NCEI CZ_TYPE=Z record is zone rather than county evidence.",
      "The initial EAGLE-I range acquisition is unqualified because its time-based search is unsafe for non-globally-time-ordered annual files; exhaustive annual scan is pending.",
      "No native customer denominator is available."
    ]
  },
  "source_receipts": [
    {
      "receipt_id": "ncei_stormevents_2019_c20260323",
      "provider": "NOAA NCEI Storm Events Database",
      "url": "https://www.ncei.noaa.gov/pub/data/swdi/stormevents/csvfiles/StormEvents_details-ftp_v1.0_d2019_c20260323.csv.gz",
      "release": "StormEvents_details-ftp_v1.0_d2019_c20260323.csv.gz; Last-Modified 2026-03-23T17:10:48Z",
      "retrieved_at_utc": "2026-09-06T07:18:49Z",
      "license_or_access": "NOAA public-data access; no file-specific license asserted by the directory response.",
      "raw_sha256": "f5043ecc776818b0feffdf1e0fcbaf63329db0635eab1057c7b8ba00ef332e3b",
      "filtered_sha256": "e14355cf010b144584b0b3cc0792fa528daa9fd80e3cd27f0683284b29415d13",
      "bytes": 11602648,
      "etag": "\"b10ad8-64db41dbdd866\"",
      "units": "NCEI local begin/end times; ice accumulation in inches.",
      "timezone_conversion": "CST-6: [2019-04-10T21:00:00Z, 2019-04-11T21:00:00Z).",
      "filters": "EVENT_ID=840941; EPISODE_ID=139802; STATE=MINNESOTA; EVENT_TYPE=Ice Storm.",
      "grid_index_mapping": "No grid index; NCEI zone 090 JACKSON.",
      "gaps": [
        "Raw gzip and canonical filtered row remain outside Git."
      ]
    },
    {
      "receipt_id": "nws_fsd_20190410_ice",
      "provider": "National Weather Service Sioux Falls",
      "url": "https://www.weather.gov/fsd/20190411-BlizzardIcestorm-CWA",
      "release": "April 10-12th, 2019 Blizzard and Ice Storm archive page",
      "retrieved_at_utc": "2026-09-06T07:13:00Z",
      "license_or_access": "U.S. National Weather Service public web archive; page terms not separately captured.",
      "raw_sha256": null,
      "filtered_sha256": null,
      "bytes": null,
      "etag": null,
      "units": "Ice accumulation in inches; narrative outage context.",
      "timezone_conversion": "No timestamp used for canonical window.",
      "filters": "Archive ice amounts and southwest Minnesota context.",
      "grid_index_mapping": "No grid index.",
      "gaps": [
        "Regional narrative is not county outage-label evidence; raw page capture unavailable."
      ]
    },
    {
      "receipt_id": "eaglei_2019_42547885_20190410t180000_20190411t000000",
      "provider": "ORNL EAGLE-I via Figshare",
      "url": "https://ndownloader.figshare.com/files/42547885",
      "release": "10.6084/m9.figshare.24237376.v4; figshare:24237376:42547885",
      "retrieved_at_utc": "2026-09-06T07:17:56.038882Z",
      "license_or_access": "CC BY 4.0 https://creativecommons.org/licenses/by/4.0/",
      "raw_sha256": "c34f355e9c93b7865307882994050abb730951428bd829bc853956acf3e9a653",
      "filtered_sha256": "667414ea56241b52767e755562beeb3e385879b06fce7400258c1f497d8791ce",
      "bytes": 1245184,
      "etag": "\"4e1b9e1ec0f0ce4a0f2fe34c5540e459-2\"",
      "units": "customers_out in customers; run_start_time UTC.",
      "timezone_conversion": "none; EAGLE-I documents UTC.",
      "filters": "state=Minnesota; FIPS=27063; [2019-04-10T18:00:00Z,2019-04-11T00:00:00Z).",
      "grid_index_mapping": "County FIPS 27063; no grid index.",
      "gaps": [
        "Initial ETag-pinned range result is acquisition_unqualified: a time-based binary search cannot prove absence in a non-globally-time-ordered annual file.",
        "No total_customers field; no population proxy."
      ]
    }
  ],
  "records": [
    {
      "record_id": "mn-2019-04-10-ice-27063-20190410t1800z",
      "county_fips": "27063",
      "boundary_vintage": "Census TIGER/Line 2024",
      "scenario_id": "mn-2019-04-10-ice-replay",
      "window_start_utc": "2019-04-10T18:00:00Z",
      "window_end_utc": "2019-04-11T00:00:00Z",
      "disposition": "candidate_only",
      "mode": "replay",
      "provenance_receipt_ids": [
        "ncei_stormevents_2019_c20260323",
        "nws_fsd_20190410_ice",
        "eaglei_2019_42547885_20190410t180000_20190411t000000"
      ],
      "source_evidence_status": "unavailable",
      "source_row_keys": [],
      "source_slices": [],
      "weather": {
        "coverage": "covered",
        "evidence_kind": "authoritative_event_report",
        "observation_kind": "observed",
        "source_receipt_ids": [
          "ncei_stormevents_2019_c20260323"
        ],
        "expected_samples": null,
        "observed_samples": null,
        "missing_timestamps": [],
        "event_report": {
          "source_event_ids": [
            "ncei:2019:139802:840941"
          ],
          "source_window": {
            "start_utc": "2019-04-10T21:00:00Z",
            "end_utc": "2019-04-11T21:00:00Z"
          },
          "spatial_scope": "zone",
          "scope_identifier": "NCEI MN zone 090 JACKSON",
          "limitations": "Zone report intersects final three hours of the canonical bin; not a county time series."
        },
        "notes": "NCEI report; no fabricated weather sample count."
      },
      "outage": {
        "coverage": "uncovered",
        "evidence_kind": "not_assessed",
        "observation_kind": "not_applicable",
        "source_receipt_ids": [],
        "expected_samples": null,
        "observed_samples": null,
        "missing_timestamps": [],
        "event_report": null,
        "notes": "Initial range receipt is acquisition_unqualified; exhaustive annual scan is pending, so absence and coverage are not asserted."
      },
      "matched_coverage_decision": "unavailable",
      "label": {
        "rule_version": "county_outage_5pct_v1",
        "status": "unavailable",
        "observed_outage_customers": null,
        "customer_denominator": {
          "status": "unavailable",
          "value": null
        },
        "outage_rate": null,
        "positive": null
      },
      "forecast": {
        "prediction_cutoff_utc": null,
        "forecast_evaluation": "not_forecast_scored",
        "inputs": []
      }
    }
  ]
}
