{
  "schema_version": "event-baseline/v1",
  "hazard": "rain-flood",
  "event": {
    "event_id": "mn-sd-ia-2014-flood",
    "parent_system_id": "mn-sd-ia-2014-flood",
    "primary_hazard": "heavy_rain",
    "secondary_hazards": [
      "river_flood"
    ],
    "compound": true,
    "source_event_ids": [
      "usgs:june-2014-mn-sd-ia"
    ],
    "context_window": {
      "start_utc": "2014-06-10T00:00:00Z",
      "end_utc": "2014-07-15T00:00:00Z"
    },
    "event_window": {
      "start_utc": "2014-06-15T00:00:00Z",
      "end_utc": "2014-06-30T00:00:00Z"
    },
    "recovery_window": {
      "start_utc": "2014-06-30T00:00:00Z",
      "end_utc": "2014-07-15T00:00:00Z"
    },
    "disposition": "shortfall",
    "selection_basis": "USGS identifies the June 2014 floods across South Dakota, Minnesota, and Iowa as a regional rain and river-flood episode.",
    "exclusions": [
      "The definitive exhaustive annual EAGLE-I scan found no rows for the predeclared St. Louis County six-hour window."
    ],
    "uncertainties": [
      "The missing rows are an UncoveredLabel, never a zero-outage result."
    ]
  },
  "source_receipts": [
    {
      "receipt_id": "usgs-mn-sd-ia-2014-flood",
      "provider": "U.S. Geological Survey",
      "url": "https://www.usgs.gov/mission-areas/water-resources/science/june-2014-floods-south-dakota-minnesota-and-iowa",
      "release": "USGS June 2014 floods science page",
      "retrieved_at_utc": "2026-09-06T07:19:09Z",
      "license_or_access": "USGS public-domain source; automated retrieval returned HTTP 403",
      "raw_sha256": null,
      "filtered_sha256": null,
      "bytes": null,
      "etag": null,
      "units": "hydrologic narrative",
      "timezone_conversion": "Source dates retained as documented; catalog windows are UTC.",
      "filters": "Candidate discovery only; no county-row extraction.",
      "grid_index_mapping": "County FIPS only; no physical-grid mapping.",
      "gaps": [
        "No durable raw bytes were obtained because the source rejected this retrieval.",
        "Regional hydrologic evidence does not prove county weather or outage coverage."
      ]
    },
    {
      "receipt_id": "eaglei-2014-42547717-20140616t000000-20140616t060000",
      "provider": "ORNL EAGLE-I via Figshare",
      "url": "https://ndownloader.figshare.com/files/42547717",
      "release": "10.6084/m9.figshare.24237376.v4; eaglei_outages_2014.csv",
      "retrieved_at_utc": "2026-09-06T07:40:32Z",
      "license_or_access": "CC BY 4.0",
      "raw_sha256": "f292a9f99066ac686df69767c535b218e70b4d4e748840ec620eda3340f914c9",
      "filtered_sha256": "667414ea56241b52767e755562beeb3e385879b06fce7400258c1f497d8791ce",
      "bytes": 78056250,
      "etag": "\"c7bfcf4b7fd26292f8d8801a26e8c52f\"",
      "units": "customers_out in customers; run_start_time UTC",
      "timezone_conversion": "none; EAGLE-I documentation states UTC",
      "filters": "Exhaustive annual stream, FIPS 27137; [2014-06-16T00:00:00Z,2014-06-16T06:00:00Z).",
      "grid_index_mapping": "County FIPS only; no physical-grid mapping.",
      "gaps": [
        "Acquisition complete: 0 valid rows across all 24 expected 15-minute intervals.",
        "Missing rows have unknown meaning and are UncoveredLabel; they are not explicit zeros.",
        "Customer denominator unavailable; no population substitution."
      ],
      "acquisition": {
        "acquisition_complete": true,
        "acquisition_method": "exhaustive_annual_stream_segmented;figshare_file_metadata_md5_and_size;etag_if_match",
        "source_system_id": "figshare:24237376:42547717",
        "source_file": "eaglei_outages_2014.csv",
        "source_file_id": 42547717,
        "source_file_bytes": 78056250,
        "integrity_basis": "figshare_file_metadata_md5_and_size+etag_pinned_full_stream",
        "raw_artifact_uri": "data/raw/event-baseline/annual-source/eaglei_outages_2014.csv",
        "raw_artifact_sha256": "f292a9f99066ac686df69767c535b218e70b4d4e748840ec620eda3340f914c9",
        "source_sidecar_uri": "data/raw/event-baseline/annual-source/eaglei_outages_2014.csv.source.json",
        "source_sidecar_sha256": "6ec43cce89ac4315d5565ac1b82ba90bde750db258414a09f3d1bc6054a6614c",
        "filtered_artifact_uri": "data/raw/event-baseline/mn-sd-ia-2014-flood-27137-20140616000000_eaglei_2014_20140616T000000_20140616T060000.csv",
        "filtered_artifact_sha256": "667414ea56241b52767e755562beeb3e385879b06fce7400258c1f497d8791ce"
      }
    }
  ],
  "records": [
    {
      "record_id": "mn-sd-ia-2014-flood-27137-2014-06-16t00z",
      "county_fips": "27137",
      "boundary_vintage": "Census 2024 county-equivalent FIPS",
      "scenario_id": "mn-sd-ia-2014-flood-replay",
      "window_start_utc": "2014-06-16T00:00:00Z",
      "window_end_utc": "2014-06-16T06:00:00Z",
      "disposition": "shortfall",
      "mode": "replay",
      "provenance_receipt_ids": [
        "usgs-mn-sd-ia-2014-flood",
        "eaglei-2014-42547717-20140616t000000-20140616t060000"
      ],
      "source_evidence_status": "unavailable",
      "source_row_keys": [],
      "source_slices": [],
      "weather": {
        "coverage": "uncovered",
        "evidence_kind": "not_assessed",
        "observation_kind": "not_applicable",
        "source_receipt_ids": [
          "usgs-mn-sd-ia-2014-flood"
        ],
        "expected_samples": null,
        "observed_samples": null,
        "missing_timestamps": [],
        "event_report": null,
        "notes": "No qualifying county/zone report or grid series is retained."
      },
      "outage": {
        "coverage": "UncoveredLabel",
        "evidence_kind": "time_series_or_grid",
        "observation_kind": "observed",
        "source_receipt_ids": [
          "eaglei-2014-42547717-20140616t000000-20140616t060000"
        ],
        "expected_samples": 24,
        "observed_samples": 0,
        "missing_timestamps": [
          "2014-06-16T00:00:00Z",
          "2014-06-16T00:15:00Z",
          "2014-06-16T00:30:00Z",
          "2014-06-16T00:45:00Z",
          "2014-06-16T01:00:00Z",
          "2014-06-16T01:15:00Z",
          "2014-06-16T01:30:00Z",
          "2014-06-16T01:45:00Z",
          "2014-06-16T02:00:00Z",
          "2014-06-16T02:15:00Z",
          "2014-06-16T02:30:00Z",
          "2014-06-16T02:45:00Z",
          "2014-06-16T03:00:00Z",
          "2014-06-16T03:15:00Z",
          "2014-06-16T03:30:00Z",
          "2014-06-16T03:45:00Z",
          "2014-06-16T04:00:00Z",
          "2014-06-16T04:15:00Z",
          "2014-06-16T04:30:00Z",
          "2014-06-16T04:45:00Z",
          "2014-06-16T05:00:00Z",
          "2014-06-16T05:15:00Z",
          "2014-06-16T05:30:00Z",
          "2014-06-16T05:45:00Z"
        ],
        "event_report": null,
        "notes": "Complete annual scan found no rows. This is UncoveredLabel, never zero outage."
      },
      "matched_coverage_decision": "unavailable",
      "label": {
        "rule_version": "county_outage_5pct_v1",
        "status": "UncoveredLabel",
        "observed_outage_customers": null,
        "customer_denominator": {
          "status": "unavailable",
          "value": null
        },
        "outage_rate": null,
        "positive": null
      },
      "forecast": {
        "prediction_cutoff_utc": null,
        "forecast_evaluation": "not_forecast_scored",
        "inputs": []
      }
    }
  ]
}
