{
  "schema_version": "event-baseline/v1",
  "hazard": "ice-freezing-rain",
  "event": {
    "event_id": "mn-wi-2022-03-29-ice",
    "parent_system_id": "upper_midwest_2022-03-29_ice",
    "primary_hazard": "ice_storm",
    "secondary_hazards": [
      "heavy_snow"
    ],
    "compound": true,
    "source_event_ids": [
      "ncei:2022:167599:1014369",
      "ncei:2022:167600:1014370",
      "ncei:2022:167600:1014371",
      "ncei:2022:167600:1014372"
    ],
    "context_window": {
      "start_utc": "2022-03-28T00:00:00Z",
      "end_utc": "2022-04-02T00:00:00Z"
    },
    "event_window": {
      "start_utc": "2022-03-30T04:00:00Z",
      "end_utc": "2022-03-30T22:00:00Z"
    },
    "recovery_window": {
      "start_utc": "2022-03-30T22:00:00Z",
      "end_utc": "2022-04-02T00:00:00Z"
    },
    "disposition": "candidate_only",
    "selection_basis": "NCEI episode 167599/event 1014369 reports quarter-inch freezing rain in the Southern Lake forecast zone; linked Wisconsin records document the same low-pressure episode.",
    "exclusions": [],
    "uncertainties": [
      "NCEI Southern Lake is a forecast zone rather than a county observation.",
      "The initial EAGLE-I range acquisition is unqualified because its time-based search is unsafe for non-globally-time-ordered annual files; exhaustive annual scan is pending."
    ]
  },
  "source_receipts": [
    {
      "receipt_id": "ncei_stormevents_2022_c20260625_mar",
      "provider": "NOAA NCEI Storm Events Database",
      "url": "https://www.ncei.noaa.gov/pub/data/swdi/stormevents/csvfiles/StormEvents_details-ftp_v1.0_d2022_c20260625.csv.gz",
      "release": "StormEvents_details-ftp_v1.0_d2022_c20260625.csv.gz; Last-Modified 2026-06-25T18:39:38Z",
      "retrieved_at_utc": "2026-09-06T07:18:49Z",
      "license_or_access": "NOAA public-data access; no file-specific license asserted by the directory response.",
      "raw_sha256": "7d6b79d0049a6edec96b061738289daddba90be26fc9afe7b0a6fd617f21452e",
      "filtered_sha256": "2ccb4a5b0f01e31eff30316ac5b37f8efd20515d625806ddff068a4a76d39dfe",
      "bytes": 11817849,
      "etag": "\"b45379-6551850843637\"",
      "units": "NCEI local begin/end times; ice accumulation in inches.",
      "timezone_conversion": "CST-6: [2022-03-30T04:00:00Z, 2022-03-30T22:00:00Z).",
      "filters": "EVENT_ID=1014369; EPISODE_ID=167599; STATE=MINNESOTA; EVENT_TYPE=Ice Storm.",
      "grid_index_mapping": "No grid index; NCEI zone 020 SOUTHERN LAKE.",
      "gaps": [
        "Raw gzip and canonical filtered row remain outside Git."
      ]
    },
    {"receipt_id":"eaglei-2022-42547897-20220330t000000-20220330t060000","provider":"ORNL EAGLE-I via Figshare","url":"https://ndownloader.figshare.com/files/42547897","release":"10.6084/m9.figshare.24237376.v4","retrieved_at_utc":"2026-09-06T08:13:45.393185Z","license_or_access":"CC BY 4.0 (https://creativecommons.org/licenses/by/4.0/)","raw_sha256":"ff8b58ae30fcbaf290f820bcd4f1420e536994bc9f0a87bb80991130478461b0","filtered_sha256":"667414ea56241b52767e755562beeb3e385879b06fce7400258c1f497d8791ce","bytes":1187596176,"etag":"\"7ce929dfa22696fee774022c7c5e5cba-2\"","units":"customers_out in customers; run_start_time UTC.","timezone_conversion":"none; EAGLE-I documentation states UTC.","filters":"Minnesota; FIPS 27075; UTC half-open [2022-03-30T00:00:00Z,2022-03-30T06:00:00Z); exhaustive annual stream.","grid_index_mapping":"No gridded index used.","gaps":["Qualified exhaustive annual scan found 0 of 24 expected 15-minute observations; this is UncoveredLabel, never zero.","Full annual source is in approved ignored storage; Figshare MD5 and ETag match the annual source sidecar.","No customer denominator; no population substitution."],"acquisition":{"acquisition_complete":true,"acquisition_method":"exhaustive_annual_stream","source_system_id":"figshare:24237376:42547897","source_file":"eaglei_outages_2022.csv","source_file_id":42547897,"source_file_bytes":1187596176,"integrity_basis":"figshare_file_metadata_md5_and_size+etag_pinned_full_stream","raw_artifact_uri":"data/raw/event-baseline/annual-source/eaglei_outages_2022.csv","raw_artifact_sha256":"ff8b58ae30fcbaf290f820bcd4f1420e536994bc9f0a87bb80991130478461b0","source_sidecar_uri":"data/raw/event-baseline/annual-source/eaglei_outages_2022.csv.source.json","source_sidecar_sha256":"23da56ec0ae7c65d1b3b08083ffb1e6d9ba53ed1ec13c9d7ebf30e507c815d08","filtered_artifact_uri":"data/raw/event-baseline/mn-wi-2022-03-29-ice-27075-20220330000000_eaglei_2022_20220330T000000_20220330T060000.csv","filtered_artifact_sha256":"667414ea56241b52767e755562beeb3e385879b06fce7400258c1f497d8791ce"}}
  ],
  "records": [
    {
      "record_id": "mn-wi-2022-03-29-ice-27075-20220330t0000z",
      "county_fips": "27075",
      "boundary_vintage": "Census TIGER/Line 2024",
      "scenario_id": "mn-wi-2022-03-29-ice-replay",
      "window_start_utc": "2022-03-30T00:00:00Z",
      "window_end_utc": "2022-03-30T06:00:00Z",
      "disposition": "candidate_only",
      "mode": "replay",
      "provenance_receipt_ids": [
        "ncei_stormevents_2022_c20260625_mar",
        "eaglei-2022-42547897-20220330t000000-20220330t060000"
      ],
      "source_evidence_status": "unavailable",
      "source_row_keys": [],
      "source_slices": [],
      "weather": {
        "coverage": "covered",
        "evidence_kind": "authoritative_event_report",
        "observation_kind": "observed",
        "source_receipt_ids": [
          "ncei_stormevents_2022_c20260625_mar"
        ],
        "expected_samples": null,
        "observed_samples": null,
        "missing_timestamps": [],
        "event_report": {
          "source_event_ids": [
            "ncei:2022:167599:1014369"
          ],
          "source_window": {
            "start_utc": "2022-03-30T04:00:00Z",
            "end_utc": "2022-03-30T22:00:00Z"
          },
          "spatial_scope": "zone",
          "scope_identifier": "NCEI MN zone 020 SOUTHERN LAKE",
          "limitations": "Zone report intersects the final two hours of the canonical bin; not a county time series."
        },
        "notes": "NCEI report; no fabricated weather sample count."
      },
      "outage": {
        "coverage": "UncoveredLabel",
        "evidence_kind": "time_series_or_grid",
        "observation_kind": "observed",
        "source_receipt_ids": ["eaglei-2022-42547897-20220330t000000-20220330t060000"],
        "expected_samples": 24,
        "observed_samples": 0,
        "missing_timestamps": ["2022-03-30T00:00:00Z","2022-03-30T00:15:00Z","2022-03-30T00:30:00Z","2022-03-30T00:45:00Z","2022-03-30T01:00:00Z","2022-03-30T01:15:00Z","2022-03-30T01:30:00Z","2022-03-30T01:45:00Z","2022-03-30T02:00:00Z","2022-03-30T02:15:00Z","2022-03-30T02:30:00Z","2022-03-30T02:45:00Z","2022-03-30T03:00:00Z","2022-03-30T03:15:00Z","2022-03-30T03:30:00Z","2022-03-30T03:45:00Z","2022-03-30T04:00:00Z","2022-03-30T04:15:00Z","2022-03-30T04:30:00Z","2022-03-30T04:45:00Z","2022-03-30T05:00:00Z","2022-03-30T05:15:00Z","2022-03-30T05:30:00Z","2022-03-30T05:45:00Z"],
        "event_report": null,
        "notes": "Qualified exhaustive annual scan: 0/24 county observations; UncoveredLabel, never a zero outage."
      },
      "matched_coverage_decision": "unavailable",
      "label": {
        "rule_version": "county_outage_5pct_v1",
        "status": "UncoveredLabel",
        "observed_outage_customers": null,
        "customer_denominator": {
          "status": "unavailable",
          "value": null
        },
        "outage_rate": null,
        "positive": null
      },
      "forecast": {
        "prediction_cutoff_utc": null,
        "forecast_evaluation": "not_forecast_scored",
        "inputs": []
      }
    }
  ]
}
